{
  "schema_version": "std-lock.v1",
  "std_version": "0.1.0-draft.47",
  "source_repository": "corezilla/STD",
  "source_revision": null,
  "source_tag": null,
  "source_manifest_path": "docs/std-source-manifest.json",
  "adopted_at": "YYYY-MM-DD",
  "project_profile": "software",
  "enabled_domains": ["management", "systems", "software", "operations"]
}
